{
  "schema_version": "1.0",
  "job_id": "job-web-c3e382183000",
  "source_files": [
    "/private/tmp/llm-autotest-local/job-web-c3e382183000/input/product_requirements.docx"
  ],
  "score": 52,
  "quality_grade": "C",
  "summary": "文档覆盖基金订单管理系统的核心业务域，但存在大量章节占位空缺（异常处理、接口规范、性能要求、项目目标、权限矩阵等），18个核心功能中仅7个给出详细规格，账户管理与交易管理多个子功能（机构/产品开户、增开交易账号、销户、赎回/快取/撤单）规则缺失，部分业务规则存在歧义（查询空条件行为、锁定后计数重置、停用基金历史影响、vol=0与对账容差逻辑），FS-EP4-3 自动对账标记为待实现，整体不足以直接支撑完整测试设计，需产研团队澄清补齐后再进入测试用例编写。",
  "dimension_scores": {
    "需求完整性": {
      "weight": 0.35,
      "score": 50,
      "reason": "18 个核心功能中仅 FS-EP0-1/0-2、EP1-1、EP2-1、EP2-4、EP3-1、EP4-1 共 7 个有详细规格；机构开户、产品开户、增开交易账号、销户、修改资料、赎回、快取、撤单、导出、差异报告、自动对账等 11 项缺失；章节 1.2、2.1、2.2、3.2、4.x.2 异常处理、5.2、6.x、7.1、8.2、9.1、9.2 均为空标题，无法支撑测试用例设计。"
    },
    "一致性与逻辑性": {
      "weight": 0.2,
      "score": 55,
      "reason": "查询条件全为空行为存在矛盾（BR3 仅要求至少一项 vs 异常表允许返回全部或提示）；申购 application_vol=0 与对账 vol 容差 ±0.01 的语义未对齐；锁定 15 分钟后失败计数是否清零未说明；停用被引用基金对历史订单的影响缺规则；业务代码字典 01/22/24/36/98/CD 与接口列举的 22/24/36 部分对齐但缺 02/08/09。"
    },
    "可测试性": {
      "weight": 0.25,
      "score": 50,
      "reason": "异常场景表格补全了部分规则但与正文异常处理小节不一致；撤单可撤状态、销户前置校验、对账差异报告分类、自动对账调度周期等关键测试条件缺失；FS-EP4-3 自动对账未实现，无法设计验收用例；多处'待澄清'阻挡测试路径构造。"
    },
    "清晰度与规范性": {
      "weight": 0.1,
      "score": 55,
      "reason": "文档具备目录、ER 图、部署图、术语表和补充场景表，结构较规范；但占位空标题过多，章节编号不连续（如 4.2.2/4.3.2 等异常处理留空），正文与附录表格存在重复且口径不一，影响可读性。"
    },
    "风险与依赖描述": {
      "weight": 0.1,
      "score": 55,
      "reason": "给出备份策略、systemd 守护、HTTPS 终止、日志目录等技术依赖；但缺少对外部依赖（TA 系统、Redis 失败计数存储、邮件/短信通知）、接口幂等性细节、对账超时异步方案依赖、Oracle 11g/12c 兼容性等关键风险说明。"
    }
  },
  "quality_assessment": {
    "grade": "C",
    "grade_name": "合格",
    "summary_reason": "核心业务逻辑（账户销户、撤单、赎回/快取、自动对账）规则缺失，多个异常处理小节空缺，FS-EP4-3 待实现，且存在查询空条件、锁定计数重置等逻辑歧义，依据评分规则核心业务逻辑、边界条件或验收标准明显缺失时不得高于 C，整体可支撑部分正向用例但不足以完整测试设计。"
  },
  "issues": [
    {
      "type": "缺失信息",
      "priority": "高",
      "location": "1.2 项目目标 / 2.1 角色定义 / 2.2 权限矩阵 / 3.2 功能列表 / 5.2 核心表清单 / 6.1-6.6 接口规范 / 7.1 性能要求 / 8.2 技术组件 / 9.1-9.2 附录",
      "question": "请补充文档中标注为空的章节（项目目标、角色定义、权限矩阵、功能列表、核心表清单、接口规范正文、性能要求正文、技术组件、术语表、业务代码字典）的具体内容或确认以附录表格为准？",
      "reason": "这些章节在正文中均为空标题，虽然文末以表格形式部分补齐，但口径与正文不一致，无法作为可执行依据",
      "impact": "无法判断非功能验收门槛、角色字段级权限边界、字典完整性，影响测试准入与覆盖率评估"
    },
    {
      "type": "缺失信息",
      "priority": "高",
      "location": "3.2 / 4.3-4.7 详细功能规格",
      "question": "FS-EP1-2 机构开户、FS-EP1-3 产品开户、FS-EP1-4 增开交易账号、FS-EP1-5 账户销户、FS-EP1-6 修改客户资料、FS-EP2-2 赎回、FS-EP2-3 快取、FS-EP2-5 撤单、FS-EP3-2 导出、FS-EP4-2 差异报告、FS-EP4-3 自动对账共 11 个核心功能何时补齐详细规格？",
      "reason": "18 个核心功能仅 7 个具备详细规格，其余仅有名称、优先级和状态",
      "impact": "测试设计覆盖度不足 50%，无法按 P0/P1 优先级铺设计用例"
    },
    {
      "type": "歧义",
      "priority": "高",
      "location": "4.6 FS-EP3-1 异常处理表 vs BR",
      "question": "查询条件全为空时系统应返回全部记录（分页）还是提示\"请至少输入一个查询条件\"并拒绝？",
      "reason": "正文 BR 仅描述三种合法查询条件，异常表同时给出\"返回全部\"和\"提示\"两种互斥行为",
      "impact": "影响查询接口的测试断言、UX 期望和性能压测基线"
    },
    {
      "type": "缺失信息",
      "priority": "高",
      "location": "3.2 FS-EP4-3 自动对账",
      "question": "FS-EP4-3 自动对账当前标记为⏳待实现，是否纳入本次测试范围？若纳入请提供调度周期、触发时间、并发限制和超时处理规则",
      "reason": "状态字段明确为待实现，但 7.3 与 8.1 暗示其将上线",
      "impact": "决定是否编写自动对账冒烟/回归用例及环境依赖"
    },
    {
      "type": "缺失信息",
      "priority": "高",
      "location": "FS-EP1-5 账户销户",
      "question": "账户销户的前置条件是什么？是否需校验无未完成订单、无持仓余额、是否存在多交易账号销户顺序约束？close_type 取值与影响范围？",
      "reason": "FS-EP1-5 在功能列表中但详细规格完全缺失，仅有 close_type 入参",
      "impact": "无法设计销户正向与异常路径用例"
    },
    {
      "type": "缺失信息",
      "priority": "高",
      "location": "FS-EP2-5 撤单",
      "question": "撤单支持哪些状态（pending/submitted/其他）、撤单时效（当日/次日/任意时点）、跨日处理、是否区分部分撤单？",
      "reason": "仅有 /api/orders/cancel/ 接口路径，缺业务规则与状态机",
      "impact": "撤单状态机缺失将导致对账数据一致性测试无法闭环"
    },
    {
      "type": "缺失信息",
      "priority": "高",
      "location": "4.2-4.7 异常处理小节",
      "question": "申购/赎回/快取/转换/撤单模块的异常处理统一规格是什么？是否需要补充幂等性（同流水号重提交）、并发冲突、TA 通信失败等异常路径？",
      "reason": "4.2.2-4.7.2 全部为空，仅依赖文末场景表，无法覆盖完整异常路径",
      "impact": "负向用例覆盖不足，影响系统韧性评估"
    },
    {
      "type": "歧义",
      "priority": "中",
      "location": "4.1 异常处理表 连续登录失败",
      "question": "账号锁定 15 分钟到期后，失败计数是否自动清零？成功登录一次是否清零？Redis 计数与 DB 用户状态如何同步？",
      "reason": "仅给出锁定时长，未定义计数重置与状态恢复规则",
      "impact": "影响安全测试用例断言和上线后运维策略"
    },
    {
      "type": "歧义",
      "priority": "中",
      "location": "4.2 异常处理表 停用被引用基金",
      "question": "停用被引用基金后，历史交易记录与对账差异如何处理？后续赎回/转换是否仍允许？",
      "reason": "仅说明允许停用并弹警告，未定义历史数据可读性与下游业务可用性",
      "impact": "影响基金生命周期用例与对账差异场景覆盖"
    },
    {
      "type": "缺失信息",
      "priority": "中",
      "location": "4.3 业务规则 BR5 / 数据模型",
      "question": "currency_type 除默认 156（人民币）外是否支持其他币种？多币种下金额/份额精度如何处理？",
      "reason": "ORDER_RECORD 与 SETTLEMENT_RECORD 模型未列出 currency_type 字段，正文仅默认 156",
      "impact": "若有多币种需求则表结构与测试需扩展"
    },
    {
      "type": "歧义",
      "priority": "中",
      "location": "4.4 BR2 vs 4.7 BR1 容差",
      "question": "申购 application_vol=0 与对账时份额容差 ±0.01 是否冲突？对账时 vol=0 是否需要按 ±0.01 容差匹配，差异如何分类？",
      "reason": "BR2 强制 vol=0，BR1 又要求 vol 在容差内匹配",
      "impact": "影响对账差异类型 vol_mismatch 的判定与告警阈值"
    },
    {
      "type": "缺失信息",
      "priority": "中",
      "location": "2.2 权限矩阵",
      "question": "管理员/操作员/审计员的字段级权限（如身份证号、手机号可见性、脱敏规则）和数据范围（按网点/销售商）如何界定？",
      "reason": "权限矩阵仅有功能级勾选，无字段级与数据范围",
      "impact": "影响权限/脱敏用例设计与合规审计"
    },
    {
      "type": "不可测",
      "priority": "中",
      "location": "7.1 性能要求",
      "question": "单接口 ≤2s、对账 ≤30s、并发 ≤50 是否提供具体压测场景（数据量、混合业务比例）、验收采样方式（P95/P99）和基线？",
      "reason": "7.1 节正文为空，仅有量化指标表格",
      "impact": "性能测试无法确定通过/不通过阈值"
    },
    {
      "type": "缺失信息",
      "priority": "中",
      "location": "4.7 对账差异报告",
      "question": "对账差异报告是否按业务代码、基金、日期范围聚合？导出 Excel/CSV 的字段顺序与最大行数限制？",
      "reason": "FS-EP4-2 仅有结果列表与导出接口，缺报表维度定义",
      "impact": "审计员报表验收标准缺失"
    },
    {
      "type": "缺失信息",
      "priority": "中",
      "location": "4.1 Token 失效",
      "question": "Token/Session 失效时前端是直接跳转登录页还是支持静默续期？多标签页同时失效如何处理？",
      "reason": "异常表仅给出\"自动重定向到登录页\"，未涉及续期策略",
      "impact": "影响前端集成与用户体验测试"
    },
    {
      "type": "缺失信息",
      "priority": "低",
      "location": "FS-EP3-2 导出",
      "question": "Excel/CSV 导出的最大行数限制、字段顺序、特殊字符处理、空值表示？是否支持异步导出？",
      "reason": "仅有 /api/orders/export/ 路径与 format 参数",
      "impact": "导出测试断言依据不足"
    },
    {
      "type": "缺失信息",
      "priority": "低",
      "location": "FS-EP4-3 自动对账",
      "question": "自动对账调度周期（每日/每小时/定时）、触发时间窗、并发调度保护机制（防重入）是什么？",
      "reason": "FS-EP4-3 状态待实现且未提供调度规则",
      "impact": "运维与稳定性测试设计受阻"
    },
    {
      "type": "歧义",
      "priority": "低",
      "location": "数据模型 ACCOUNT",
      "question": "fund_account_id（TA 账号，12 位）与 transaction_account_id（交易账号，64 位 UUID）一对一还是一对多？增开交易账号时 ta_account_id 是否复用？",
      "reason": "ER 图同时列出两个账号字段，FS-EP1-4 接口仅传 ta_account_id",
      "impact": "影响账户关联与对账准确性测试"
    },
    {
      "type": "缺失信息",
      "priority": "低",
      "location": "FS-EP1-6 修改客户资料",
      "question": "修改客户资料的允许字段清单（cellphone/email/address/银行账户等）、是否需审核流、历史版本是否保留？",
      "reason": "接口仅有 PUT /api/accounts/{id}/，无字段白名单与审计规则",
      "impact": "资料修改合规审计测试设计不足"
    },
    {
      "type": "缺失信息",
      "priority": "低",
      "location": "7.2 安全性",
      "question": "密码复杂度（长度、字符集、有效期）与历史密码校验规则是什么？是否强制首次登录修改默认密码？",
      "reason": "安全性小节仅涉及存储与会话，未提复杂度与策略",
      "impact": "安全合规测试覆盖不足"
    }
  ],
  "readable_issue_points": [
    "大量关键章节（项目目标、角色权限、接口规范、性能要求、异常处理）正文为空，无法作为测试设计依据",
    "18 个核心功能中仅 7 个具备详细规格，其余 11 个（机构/产品开户、增开交易账号、销户、修改资料、赎回、快取、撤单、导出、差异报告、自动对账）规则缺失",
    "查询条件全为空时返回全部 vs 提示的两种互斥行为未统一",
    "FS-EP4-3 自动对账标记为待实现，请确认是否纳入本轮测试范围",
    "账户销户（FS-EP1-5）缺前置条件、close_type 取值与多交易账号销户顺序规则",
    "撤单（FS-EP2-5）缺状态机、时效、跨日处理等业务规则",
    "申购/赎回/快取/转换/撤单模块异常处理小节全部为空，需补充统一异常规格"
  ],
  "completeness_issues": [
    "1.2 项目目标正文为空",
    "2.1 角色定义与 2.2 权限矩阵正文为空",
    "3.2 功能列表正文为空",
    "4.1.2/4.2.2/4.3.2/4.4.2/4.5.2/4.6.2/4.7.2 异常处理小节全部为空",
    "5.2 核心表清单正文为空",
    "6.1-6.6 接口规范正文为空",
    "7.1 性能要求正文为空",
    "8.2 技术组件正文为空",
    "9.1 术语表与 9.2 业务代码字典正文为空",
    "11 个核心功能（FS-EP1-2/3/4/5/6、FS-EP2-2/3/5、FS-EP3-2、FS-EP4-2/3）缺详细规格"
  ],
  "consistency_issues": [
    "FS-EP3-1 查询空条件：正文 BR 仅要求至少一项，异常表同时给出\"返回全部\"和\"提示拒绝\"两种互斥行为",
    "申购 application_vol=0 与对账 vol 容差 ±0.01 在数据一致性语义上未对齐",
    "锁定账号 15 分钟到期后失败计数是否清零未定义",
    "停用被引用基金对历史交易的影响未明确",
    "业务代码字典（01/02/08/09/22/24/98/36/CD）与接口列举代码（22/24/36）口径不一致，缺 02/08/09",
    "currency_type 默认 156 但数据模型未列出该字段"
  ],
  "untestable_items": [
    "FS-EP4-3 自动对账调度（待实现，无调度规则与并发保护）",
    "FS-EP1-5 账户销户前置条件与 close_type 取值（规则缺失）",
    "FS-EP2-5 撤单状态机与时效（规则缺失）",
    "FS-EP1-2/3/4/6 机构/产品开户、增开交易账号、修改客户资料（详细规格缺失）",
    "FS-EP2-2/3 赎回与快取下单（详细规格缺失）",
    "FS-EP4-2 对账差异报告维度（仅接口路径，无聚合/分类规则）",
    "7.1 性能要求压测场景与采样方式（章节为空，仅有量化指标）",
    "字段级权限与数据脱敏规则（权限矩阵仅有功能级勾选）"
  ],
  "risk_flags": [
    {
      "type": "incomplete-spec",
      "desc": "核心业务逻辑章节占位空缺，影响测试准入"
    },
    {
      "type": "missing-rules",
      "desc": "11 个核心功能缺详细规格，测试覆盖不足"
    },
    {
      "type": "ambiguous-logic",
      "desc": "查询空条件、锁定计数重置、停用历史订单等存在歧义"
    },
    {
      "type": "pending-feature",
      "desc": "自动对账 FS-EP4-3 状态为待实现，需确认测试范围"
    },
    {
      "type": "data-consistency",
      "desc": "双表写入事务与对账容差语义未对齐，存在差异判定争议"
    },
    {
      "type": "non-functional-gap",
      "desc": "性能/可扩展性压测场景缺失"
    },
    {
      "type": "security-detail",
      "desc": "字段级权限、密码复杂度、审计策略未定义"
    },
    {
      "type": "external-dependency",
      "desc": "Redis 失败计数、TA 系统对接、邮件短信通知依赖未识别"
    },
    {
      "type": "unclear-data-model",
      "desc": "fund_account_id 与 transaction_account_id 映射关系不明"
    },
    {
      "type": "doc-version",
      "desc": "v1.0 初稿状态\"已确认\"但仍有多处占位，存在版本管理风险"
    }
  ],
  "testable_features": [
    "FS-EP0-1 用户登录：用户名密码登录成功、登录失败、连续 5 次失败锁定 15 分钟、Session 24 小时过期自动重定向",
    "FS-EP0-1 用户登录：PBKDF2 密码哈希存储、Redis 失败计数维护、Token 写入 localStorage",
    "FS-EP0-1 用户登录：RBAC 角色（管理员/操作员/审计员）功能级权限边界",
    "FS-EP0-2 产品配置管理：新增基金 6 位数字代码、A/B 份额类型、默认启用状态",